[
  {
    "id": "PSY-001",
    "dimension": "knowledge",
    "topic": "memoria y sugestibilidad",
    "difficulty": "easy",
    "question": "Explica qué es el efecto de desinformación en la memoria y describe, de forma breve, cómo puede producirse después de presenciar un acontecimiento.",
    "expected_answer": "El efecto de desinformación consiste en que información posterior a un acontecimiento puede incorporarse o interferir en el recuerdo del acontecimiento original, haciendo que la persona recuerde posteriormente detalles que no estaban presentes. Un ejemplo válido es que, después de ver un accidente, una persona reciba una descripción que contiene un detalle falso y posteriormente lo recuerde como si hubiera formado parte de la escena original.",
    "evaluation_criteria": [
      {
        "criterion": "Define correctamente el efecto como una alteración del recuerdo por información posterior y explica que la información posterior puede incorporarse al recuerdo o modificar su recuperación. Incluye un ejemplo coherente.",
        "max_points": 3
      },
      {
        "criterion": "Identifica que información posterior puede alterar el recuerdo, pero explica de forma incompleta el mecanismo o proporciona un ejemplo poco preciso.",
        "max_points": 2
      },
      {
        "criterion": "Menciona únicamente que la memoria puede ser inexacta sin relacionarlo específicamente con información posterior al acontecimiento.",
        "max_points": 1
      }
    ],
    "source": "Loftus, E. F., & Palmer, J. C. (1974). Reconstruction of automobile destruction: An example of the interaction between language and memory. Journal of Verbal Learning and Verbal Behavior, 13(5), 585-589. DOI: 10.1016/S0022-5371(74)80011-3.",
    "notes": "Ítem factual de recuperación conceptual. La formulación evita reproducir directamente el paradigma clásico del accidente automovilístico. La explicación del mecanismo puede formularse de distintas maneras sin exigir una teoría única sobre el locus exacto de la distorsión.",
    "critical_errors": [
      "Afirmar que la desinformación siempre sustituye por completo el recuerdo original.",
      "Definir el fenómeno como una alteración producida exclusivamente por información previa al acontecimiento."
    ],
    "language": "es-ES"
  },
  {
    "id": "PSY-002",
    "dimension": "knowledge",
    "topic": "memoria de trabajo",
    "difficulty": "medium",
    "question": "¿Qué función cumple el ejecutivo central dentro del modelo de memoria de trabajo de Baddeley? Diferéncialo de los sistemas que almacenan temporalmente información específica.",
    "expected_answer": "El ejecutivo central es un sistema de control atencional que coordina y regula el procesamiento de información y la asignación de recursos entre componentes de la memoria de trabajo. Se diferencia de componentes como el bucle fonológico o la agenda visuoespacial, que mantienen temporalmente información de determinadas modalidades.",
    "evaluation_criteria": [
      {
        "criterion": "Describe el ejecutivo central como sistema de control/coordinación atencional y lo diferencia explícitamente de al menos dos sistemas de mantenimiento temporal, como el bucle fonológico y la agenda visuoespacial.",
        "max_points": 3
      },
      {
        "criterion": "Identifica correctamente su función de control o coordinación, pero diferencia de forma incompleta los componentes.",
        "max_points": 2
      },
      {
        "criterion": "Lo describe simplemente como un almacén de información temporal o menciona memoria de trabajo sin explicar su función específica.",
        "max_points": 1
      }
    ],
    "source": "Baddeley, A. (2000). The episodic buffer: A new component of working memory? Trends in Cognitive Sciences, 4(11), 417-423. DOI: 10.1016/S1364-6613(00)01538-2.",
    "notes": "La pregunta evalúa conocimiento conceptual del modelo y no exige recordar detalles históricos de sus distintas versiones.",
    "critical_errors": [
      "Definir el ejecutivo central como un almacén pasivo equivalente al bucle fonológico."
    ],
    "language": "es-ES"
  },
  {
    "id": "PSY-003",
    "dimension": "knowledge",
    "topic": "aprendizaje y práctica distribuida",
    "difficulty": "medium",
    "question": "¿Qué se entiende por efecto de espaciamiento en el aprendizaje y cómo se diferencia de concentrar todo el estudio en una única sesión?",
    "expected_answer": "El efecto de espaciamiento consiste en que, en muchas condiciones, distribuir las sesiones de estudio a lo largo del tiempo produce una retención posterior mejor que concentrar el estudio en una sola sesión o en un intervalo muy corto. La ventaja depende, entre otros factores, del intervalo entre sesiones y del momento en que se evalúa el aprendizaje.",
    "evaluation_criteria": [
      {
        "criterion": "Define el espaciamiento como distribución temporal de las oportunidades de aprendizaje y lo contrasta con la práctica masiva, indicando que suele mejorar la retención posterior. Reconoce que el efecto depende de las condiciones.",
        "max_points": 3
      },
      {
        "criterion": "Explica correctamente la distribución temporal y su ventaja general, pero omite los condicionantes.",
        "max_points": 2
      },
      {
        "criterion": "Afirma que estudiar en varias sesiones es mejor sin explicar que la característica relevante es la separación temporal.",
        "max_points": 1
      }
    ],
    "source": "Cepeda, N. J., Pashler, H., Vul, E., Wixted, J. T., & Rohrer, D. (2006). Distributed practice in verbal recall tasks: A review and quantitative synthesis. Psychological Bulletin, 132(3), 354-380. DOI: 10.1037/0033-2909.132.3.354.",
    "notes": "La pregunta evita convertir el efecto en una regla absoluta: la literatura muestra dependencia de las condiciones de aprendizaje y evaluación.",
    "critical_errors": [
      "Confundir el efecto de espaciamiento con aumentar simplemente el número total de horas de estudio."
    ],
    "language": "es-ES"
  },
  {
    "id": "PSY-004",
    "dimension": "knowledge",
    "topic": "atención y efecto Stroop",
    "difficulty": "medium",
    "question": "En la tarea Stroop clásica se observa una asimetría: nombrar el color de la tinta se vuelve más lento cuando la palabra escrita designa un color incongruente, mientras que leer la palabra apenas se ve afectada por el color de la tinta en que está impresa. Explica a qué se atribuye esta asimetría y, a partir de ello, predice qué ocurriría con la magnitud de la interferencia si se degradara visualmente la palabra (reduciendo su legibilidad) manteniendo perfectamente identificable el color de la tinta. Justifica la predicción.",
    "expected_answer": "La asimetría se atribuye a que la lectura de la palabra es un proceso más automatizado y rápido, y más difícil de inhibir, que la denominación del color: la dimensión más automatizada interfiere sobre la menos automatizada y no a la inversa. Este principio se formula habitualmente en términos de velocidad relativa de procesamiento o de fuerza relativa de las vías implicadas, sin que sea necesario adoptar una única teoría mecanística. A partir de ese principio, degradar visualmente la palabra debería reducir la interferencia, porque enlentece o debilita el procesamiento de la dimensión irrelevante y disminuye su ventaja relativa sobre la denominación del color. Lo esencial es que la magnitud de la interferencia depende de la relación entre ambas dimensiones y no únicamente de la presencia de una palabra de color.",
    "evaluation_criteria": [
      {
        "criterion": "Atribuye la asimetría a la mayor automatización o velocidad relativa del procesamiento de la palabra frente a la denominación del color, predice correctamente que degradar la palabra reduce la interferencia y justifica la predicción vinculándola explícitamente a esa relación entre dimensiones.",
        "max_points": 3
      },
      {
        "criterion": "Explica correctamente el origen de la asimetría y predice la dirección correcta del cambio, pero justifica la predicción de forma vaga o sin conectarla con la automaticidad o la velocidad relativa de procesamiento.",
        "max_points": 2
      },
      {
        "criterion": "Describe el efecto Stroop o constata la asimetría sin explicar su origen, o bien acierta la dirección de la predicción sin ninguna justificación basada en el procesamiento relativo de las dos dimensiones.",
        "max_points": 1
      }
    ],
    "source": "MacLeod, C. M. (1991). Half a century of research on the Stroop effect: An integrative review. Psychological Bulletin, 109(2), 163-203. DOI: 10.1037/0033-2909.109.2.163.",
    "notes": "Ítem rediseñado para que no pueda resolverse recuperando una definición: exige el principio de automaticidad/velocidad relativa que explica la asimetría y su aplicación para predecir el efecto de una manipulación del paradigma. La interpretación mecanística concreta del efecto Stroop sigue siendo objeto de debate; se aceptan formulaciones en términos de velocidad relativa de procesamiento o de fuerza de las vías de procesamiento sin exigir una teoría única. La predicción se puntúa por la justificación, no por citar un estudio concreto.",
    "critical_errors": [
      "Invertir el sentido de la tarea o de la asimetría, afirmando que la interferencia consiste en que el color de la tinta dificulta leer la palabra.",
      "Predecir que degradar la palabra aumenta la interferencia porque 'hace la tarea más difícil', sin distinguir cuál de las dos dimensiones se ha degradado.",
      "Atribuir la asimetría a que el color es intrínsecamente más difícil de percibir que las letras, en lugar de a la automaticidad relativa de la lectura."
    ],
    "language": "es-ES"
  },
  {
    "id": "PSY-005",
    "dimension": "knowledge",
    "topic": "personalidad",
    "difficulty": "medium",